doi,title,abstract,included,decision_source,final_verdict,landing_url,pdf_url,year,source_anchor,source_term,metadata_json,arxiv_id,openalex_id
10.48550/arxiv.2309.00126,QS-TTS: Towards Semi-Supervised Text-to-Speech Synthesis via Vector-Quantized Self-Supervised Speech Representation Learning,"This paper proposes a novel semi-supervised TTS framework, QS-TTS, to improve TTS quality with lower supervised data requirements via Vector-Quantized Self-Supervised Speech Representation Learning (VQ-S3RL) utilizing more unlabeled speech audio. This framework comprises two VQ-S3R learners: first, the principal learner aims to provide a generative Multi-Stage Multi-Codebook (MSMC) VQ-S3R via the MSMC-VQ-GAN combined with the contrastive S3RL, while decoding it back to the high-quality audio; then, the associate learner further abstracts the MSMC representation into a highly-compact VQ representation through a VQ-VAE. These two generative VQ-S3R learners provide profitable speech representations and pre-trained models for TTS, significantly improving synthesis quality with the lower requirement for supervised data. QS-TTS is evaluated comprehensively under various scenarios via subjective and objective tests in experiments. The results powerfully demonstrate the superior performance of QS-TTS, winning the highest MOS over supervised or semi-supervised baseline TTS approaches, especially in low-resource scenarios. Moreover, comparing various speech representations and transfer learning methods in TTS further validates the notable improvement of the proposed VQ-S3RL to TTS, showing the best audio quality and intelligibility metrics. The trend of slower decay in the synthesis quality of QS-TTS with decreasing supervised data further highlights its lower requirements for supervised data, indicating its great potential in low-resource scenarios.",1,,include (junior:5),https://arxiv.org/abs/2309.00126v1,https://arxiv.org/pdf/2309.00126v1,2023,discrete speech tokens,vq gan,"{""arxiv_id"": ""2309.00126"", ""title"": ""QS-TTS: Towards Semi-Supervised Text-to-Speech Synthesis via Vector-Quantized Self-Supervised Speech Representation Learning"", ""summary"": ""This paper proposes a novel semi-supervised TTS framework, QS-TTS, to improve TTS quality with lower supervised data requirements via Vector-Quantized Self-Supervised Speech Representation Learning (VQ-S3RL) utilizing more unlabeled speech audio. This framework comprises two VQ-S3R learners: first, the principal learner aims to provide a generative Multi-Stage Multi-Codebook (MSMC) VQ-S3R via the MSMC-VQ-GAN combined with the contrastive S3RL, while decoding it back to the high-quality audio; then, the associate learner further abstracts the MSMC representation into a highly-compact VQ representation through a VQ-VAE. These two generative VQ-S3R learners provide profitable speech representations and pre-trained models for TTS, significantly improving synthesis quality with the lower requirement for supervised data. QS-TTS is evaluated comprehensively under various scenarios via subjective and objective tests in experiments. The results powerfully demonstrate the superior performance of QS-TTS, winning the highest MOS over supervised or semi-supervised baseline TTS approaches, especially in low-resource scenarios. Moreover, comparing various speech representations and transfer learning methods in TTS further validates the notable improvement of the proposed VQ-S3RL to TTS, showing the best audio quality and intelligibility metrics. The trend of slower decay in the synthesis quality of QS-TTS with decreasing supervised data further highlights its lower requirements for supervised data, indicating its great potential in low-resource scenarios."", ""authors"": [""Haohan Guo"", ""Fenglong Xie"", ""Jiawen Kang"", ""Yujia Xiao"", ""Xixin Wu"", ""Helen Meng""], ""published"": ""2023-08-31T20:25:44Z"", ""updated"": ""2023-08-31T20:25:44Z"", ""categories"": [""cs.SD"", ""cs.CL"", ""eess.AS""], ""pdf_url"": ""https://arxiv.org/pdf/2309.00126v1"", ""landing_url"": ""https://arxiv.org/abs/2309.00126v1"", ""doi"": ""https://doi.org/10.48550/arXiv.2309.00126""}",2309.00126,https://openalex.org/W4386435838
10.48550/arxiv.2309.00169,RepCodec: A Speech Representation Codec for Speech Tokenization,"With recent rapid growth of large language models (LLMs), discrete speech tokenization has played an important role for injecting speech into LLMs. However, this discretization gives rise to a loss of information, consequently impairing overall performance. To improve the performance of these discrete speech tokens, we present RepCodec, a novel speech representation codec for semantic speech tokenization. In contrast to audio codecs which reconstruct the raw audio, RepCodec learns a vector quantization codebook through reconstructing speech representations from speech encoders like HuBERT or data2vec. Together, the speech encoder, the codec encoder and the vector quantization codebook form a pipeline for converting speech waveforms into semantic tokens. The extensive experiments illustrate that RepCodec, by virtue of its enhanced information retention capacity, significantly outperforms the widely used k-means clustering approach in both speech understanding and generation. Furthermore, this superiority extends across various speech encoders and languages, affirming the robustness of RepCodec. We believe our method can facilitate large language modeling research on speech processing.",1,,include (junior:5),https://arxiv.org/abs/2309.00169v3,https://arxiv.org/pdf/2309.00169v3,2023,discrete speech tokens,speech tokens,"{""arxiv_id"": ""2309.00169"", ""title"": ""RepCodec: A Speech Representation Codec for Speech Tokenization"", ""summary"": ""With recent rapid growth of large language models (LLMs), discrete speech tokenization has played an important role for injecting speech into LLMs. However, this discretization gives rise to a loss of information, consequently impairing overall performance. To improve the performance of these discrete speech tokens, we present RepCodec, a novel speech representation codec for semantic speech tokenization. In contrast to audio codecs which reconstruct the raw audio, RepCodec learns a vector quantization codebook through reconstructing speech representations from speech encoders like HuBERT or data2vec. Together, the speech encoder, the codec encoder and the vector quantization codebook form a pipeline for converting speech waveforms into semantic tokens. The extensive experiments illustrate that RepCodec, by virtue of its enhanced information retention capacity, significantly outperforms the widely used k-means clustering approach in both speech understanding and generation. Furthermore, this superiority extends across various speech encoders and languages, affirming the robustness of RepCodec. We believe our method can facilitate large language modeling research on speech processing."", ""authors"": [""Zhichao Huang"", ""Chutong Meng"", ""Tom Ko""], ""published"": ""2023-08-31T23:26:10Z"", ""updated"": ""2024-07-22T09:53:44Z"", ""categories"": [""eess.AS"", ""cs.LG"", ""cs.SD""], ""pdf_url"": ""https://arxiv.org/pdf/2309.00169v3"", ""landing_url"": ""https://arxiv.org/abs/2309.00169v3"", ""doi"": ""https://doi.org/10.48550/arXiv.2309.00169""}",2309.00169,https://openalex.org/W4386437507
10.1109/lsp.2023.3313513,Direct Text to Speech Translation System using Acoustic Units,"This paper proposes a direct text to speech translation system using discrete acoustic units. This framework employs text in different source languages as input to generate speech in the target language without the need for text transcriptions in this language. Motivated by the success of acoustic units in previous works for direct speech to speech translation systems, we use the same pipeline to extract the acoustic units using a speech encoder combined with a clustering algorithm. Once units are obtained, an encoder-decoder architecture is trained to predict them. Then a vocoder generates speech from units. Our approach for direct text to speech translation was tested on the new CVSS corpus with two different text mBART models employed as initialisation. The systems presented report competitive performance for most of the language pairs evaluated. Besides, results show a remarkable improvement when initialising our proposed architecture with a model pre-trained with more languages.",1,,include (junior:5),https://arxiv.org/abs/2309.07478v1,https://arxiv.org/pdf/2309.07478v1,2023,discrete speech tokens,text to speech,"{""arxiv_id"": ""2309.07478"", ""title"": ""Direct Text to Speech Translation System using Acoustic Units"", ""summary"": ""This paper proposes a direct text to speech translation system using discrete acoustic units. This framework employs text in different source languages as input to generate speech in the target language without the need for text transcriptions in this language. Motivated by the success of acoustic units in previous works for direct speech to speech translation systems, we use the same pipeline to extract the acoustic units using a speech encoder combined with a clustering algorithm. Once units are obtained, an encoder-decoder architecture is trained to predict them. Then a vocoder generates speech from units. Our approach for direct text to speech translation was tested on the new CVSS corpus with two different text mBART models employed as initialisation. The systems presented report competitive performance for most of the language pairs evaluated. Besides, results show a remarkable improvement when initialising our proposed architecture with a model pre-trained with more languages."", ""authors"": [""Victoria Mingote"", ""Pablo Gimeno"", ""Luis Vicente"", ""Sameer Khurana"", ""Antoine Laurent"", ""Jarod Duret""], ""published"": ""2023-09-14T07:35:14Z"", ""updated"": ""2023-09-14T07:35:14Z"", ""categories"": [""cs.CL"", ""cs.LG"", ""cs.SD"", ""eess.AS""], ""pdf_url"": ""https://arxiv.org/pdf/2309.07478v1"", ""landing_url"": ""https://arxiv.org/abs/2309.07478v1"", ""doi"": ""https://doi.org/10.1109/LSP.2023.3313513""}",2309.07478,https://openalex.org/W4386590854
10.48550/arxiv.2309.07937,Voxtlm: unified decoder-only models for consolidating speech recognition/synthesis and speech/text continuation tasks,"We propose a decoder-only language model, VoxtLM, that can perform four tasks: speech recognition, speech synthesis, text generation, and speech continuation. VoxtLM integrates text vocabulary with discrete speech tokens from self-supervised speech features and uses special tokens to enable multitask learning. Compared to a single-task model, VoxtLM exhibits a significant improvement in speech synthesis, with improvements in both speech intelligibility from 28.9 to 5.6 and objective quality from 2.68 to 3.90. VoxtLM also improves speech generation and speech recognition performance over the single-task counterpart. Further, VoxtLM is trained with publicly available data and training recipes and model checkpoints are open-sourced to make fully reproducible work.",1,,include (junior:5),https://arxiv.org/abs/2309.07937v3,https://arxiv.org/pdf/2309.07937v3,2023,discrete speech tokens,speech tokens,"{""arxiv_id"": ""2309.07937"", ""title"": ""Voxtlm: unified decoder-only models for consolidating speech recognition/synthesis and speech/text continuation tasks"", ""summary"": ""We propose a decoder-only language model, VoxtLM, that can perform four tasks: speech recognition, speech synthesis, text generation, and speech continuation. VoxtLM integrates text vocabulary with discrete speech tokens from self-supervised speech features and uses special tokens to enable multitask learning. Compared to a single-task model, VoxtLM exhibits a significant improvement in speech synthesis, with improvements in both speech intelligibility from 28.9 to 5.6 and objective quality from 2.68 to 3.90. VoxtLM also improves speech generation and speech recognition performance over the single-task counterpart. Further, VoxtLM is trained with publicly available data and training recipes and model checkpoints are open-sourced to make fully reproducible work."", ""authors"": [""Soumi Maiti"", ""Yifan Peng"", ""Shukjae Choi"", ""Jee-weon Jung"", ""Xuankai Chang"", ""Shinji Watanabe""], ""published"": ""2023-09-14T03:13:18Z"", ""updated"": ""2024-01-24T15:36:31Z"", ""categories"": [""eess.AS"", ""cs.LG"", ""cs.SD""], ""pdf_url"": ""https://arxiv.org/pdf/2309.07937v3"", ""landing_url"": ""https://arxiv.org/abs/2309.07937v3"", ""doi"": ""https://doi.org/10.48550/arXiv.2309.07937""}",2309.07937,https://openalex.org/W4386874750
10.48550/arxiv.2309.11977,Improving Language Model-Based Zero-Shot Text-to-Speech Synthesis with Multi-Scale Acoustic Prompts,"Zero-shot text-to-speech (TTS) synthesis aims to clone any unseen speaker's voice without adaptation parameters. By quantizing speech waveform into discrete acoustic tokens and modeling these tokens with the language model, recent language model-based TTS models show zero-shot speaker adaptation capabilities with only a 3-second acoustic prompt of an unseen speaker. However, they are limited by the length of the acoustic prompt, which makes it difficult to clone personal speaking style. In this paper, we propose a novel zero-shot TTS model with the multi-scale acoustic prompts based on a neural codec language model VALL-E. A speaker-aware text encoder is proposed to learn the personal speaking style at the phoneme-level from the style prompt consisting of multiple sentences. Following that, a VALL-E based acoustic decoder is utilized to model the timbre from the timbre prompt at the frame-level and generate speech. The experimental results show that our proposed method outperforms baselines in terms of naturalness and speaker similarity, and can achieve better performance by scaling out to a longer style prompt.",1,,include (junior:5),https://arxiv.org/abs/2309.11977v3,https://arxiv.org/pdf/2309.11977v3,2023,acoustic tokens,offline clustering,"{""arxiv_id"": ""2309.11977"", ""title"": ""Improving Language Model-Based Zero-Shot Text-to-Speech Synthesis with Multi-Scale Acoustic Prompts"", ""summary"": ""Zero-shot text-to-speech (TTS) synthesis aims to clone any unseen speaker's voice without adaptation parameters. By quantizing speech waveform into discrete acoustic tokens and modeling these tokens with the language model, recent language model-based TTS models show zero-shot speaker adaptation capabilities with only a 3-second acoustic prompt of an unseen speaker. However, they are limited by the length of the acoustic prompt, which makes it difficult to clone personal speaking style. In this paper, we propose a novel zero-shot TTS model with the multi-scale acoustic prompts based on a neural codec language model VALL-E. A speaker-aware text encoder is proposed to learn the personal speaking style at the phoneme-level from the style prompt consisting of multiple sentences. Following that, a VALL-E based acoustic decoder is utilized to model the timbre from the timbre prompt at the frame-level and generate speech. The experimental results show that our proposed method outperforms baselines in terms of naturalness and speaker similarity, and can achieve better performance by scaling out to a longer style prompt."", ""authors"": [""Shun Lei"", ""Yixuan Zhou"", ""Liyang Chen"", ""Dan Luo"", ""Zhiyong Wu"", ""Xixin Wu"", ""Shiyin Kang"", ""Tao Jiang"", ""Yahui Zhou"", ""Yuxing Han"", ""Helen Meng""], ""published"": ""2023-09-21T11:22:22Z"", ""updated"": ""2024-04-09T08:39:52Z"", ""categories"": [""cs.SD"", ""eess.AS""], ""pdf_url"": ""https://arxiv.org/pdf/2309.11977v3"", ""landing_url"": ""https://arxiv.org/abs/2309.11977v3"", ""doi"": ""https://doi.org/10.48550/arXiv.2309.11977""}",2309.11977,https://openalex.org/W4386977793
10.48550/arxiv.2309.14324,Towards General-Purpose Text-Instruction-Guided Voice Conversion,"This paper introduces a novel voice conversion (VC) model, guided by text instructions such as ""articulate slowly with a deep tone"" or ""speak in a cheerful boyish voice"". Unlike traditional methods that rely on reference utterances to determine the attributes of the converted speech, our model adds versatility and specificity to voice conversion. The proposed VC model is a neural codec language model which processes a sequence of discrete codes, resulting in the code sequence of converted speech. It utilizes text instructions as style prompts to modify the prosody and emotional information of the given speech. In contrast to previous approaches, which often rely on employing separate encoders like prosody and content encoders to handle different aspects of the source speech, our model handles various information of speech in an end-to-end manner. Experiments have demonstrated the impressive capabilities of our model in comprehending instructions and delivering reasonable results.",1,,include (junior:5),https://arxiv.org/abs/2309.14324v2,https://arxiv.org/pdf/2309.14324v2,2023,discrete speech tokens,voice conversion,"{""arxiv_id"": ""2309.14324"", ""title"": ""Towards General-Purpose Text-Instruction-Guided Voice Conversion"", ""summary"": ""This paper introduces a novel voice conversion (VC) model, guided by text instructions such as \""articulate slowly with a deep tone\"" or \""speak in a cheerful boyish voice\"". Unlike traditional methods that rely on reference utterances to determine the attributes of the converted speech, our model adds versatility and specificity to voice conversion. The proposed VC model is a neural codec language model which processes a sequence of discrete codes, resulting in the code sequence of converted speech. It utilizes text instructions as style prompts to modify the prosody and emotional information of the given speech. In contrast to previous approaches, which often rely on employing separate encoders like prosody and content encoders to handle different aspects of the source speech, our model handles various information of speech in an end-to-end manner. Experiments have demonstrated the impressive capabilities of our model in comprehending instructions and delivering reasonable results."", ""authors"": [""Chun-Yi Kuan"", ""Chen An Li"", ""Tsu-Yuan Hsu"", ""Tse-Yang Lin"", ""Ho-Lam Chung"", ""Kai-Wei Chang"", ""Shuo-yiin Chang"", ""Hung-yi Lee""], ""published"": ""2023-09-25T17:52:09Z"", ""updated"": ""2024-01-16T13:53:56Z"", ""categories"": [""eess.AS"", ""cs.CL"", ""cs.LG"", ""cs.SD""], ""pdf_url"": ""https://arxiv.org/pdf/2309.14324v2"", ""landing_url"": ""https://arxiv.org/abs/2309.14324v2"", ""doi"": ""https://doi.org/10.48550/arXiv.2309.14324""}",2309.14324,https://openalex.org/W4387076541
10.48550/arxiv.2310.07246,Vec-Tok Speech: speech vectorization and tokenization for neural speech generation,"Language models (LMs) have recently flourished in natural language processing and computer vision, generating high-fidelity texts or images in various tasks. In contrast, the current speech generative models are still struggling regarding speech quality and task generalization. This paper presents Vec-Tok Speech, an extensible framework that resembles multiple speech generation tasks, generating expressive and high-fidelity speech. Specifically, we propose a novel speech codec based on speech vectors and semantic tokens. Speech vectors contain acoustic details contributing to high-fidelity speech reconstruction, while semantic tokens focus on the linguistic content of speech, facilitating language modeling. Based on the proposed speech codec, Vec-Tok Speech leverages an LM to undertake the core of speech generation. Moreover, Byte-Pair Encoding (BPE) is introduced to reduce the token length and bit rate for lower exposure bias and longer context coverage, improving the performance of LMs. Vec-Tok Speech can be used for intra- and cross-lingual zero-shot voice conversion (VC), zero-shot speaking style transfer text-to-speech (TTS), speech-to-speech translation (S2ST), speech denoising, and speaker de-identification and anonymization. Experiments show that Vec-Tok Speech, built on 50k hours of speech, performs better than other SOTA models. Code will be available at https://github.com/BakerBunker/VecTok .",1,,include (junior:5),https://arxiv.org/abs/2310.07246v2,https://arxiv.org/pdf/2310.07246v2,2023,discrete speech tokens,speech generation,"{""arxiv_id"": ""2310.07246"", ""title"": ""Vec-Tok Speech: speech vectorization and tokenization for neural speech generation"", ""summary"": ""Language models (LMs) have recently flourished in natural language processing and computer vision, generating high-fidelity texts or images in various tasks. In contrast, the current speech generative models are still struggling regarding speech quality and task generalization. This paper presents Vec-Tok Speech, an extensible framework that resembles multiple speech generation tasks, generating expressive and high-fidelity speech. Specifically, we propose a novel speech codec based on speech vectors and semantic tokens. Speech vectors contain acoustic details contributing to high-fidelity speech reconstruction, while semantic tokens focus on the linguistic content of speech, facilitating language modeling. Based on the proposed speech codec, Vec-Tok Speech leverages an LM to undertake the core of speech generation. Moreover, Byte-Pair Encoding (BPE) is introduced to reduce the token length and bit rate for lower exposure bias and longer context coverage, improving the performance of LMs. Vec-Tok Speech can be used for intra- and cross-lingual zero-shot voice conversion (VC), zero-shot speaking style transfer text-to-speech (TTS), speech-to-speech translation (S2ST), speech denoising, and speaker de-identification and anonymization. Experiments show that Vec-Tok Speech, built on 50k hours of speech, performs better than other SOTA models. Code will be available at https://github.com/BakerBunker/VecTok ."", ""authors"": [""Xinfa Zhu"", ""Yuanjun Lv"", ""Yi Lei"", ""Tao Li"", ""Wendi He"", ""Hongbin Zhou"", ""Heng Lu"", ""Lei Xie""], ""published"": ""2023-10-11T07:23:27Z"", ""updated"": ""2023-10-12T05:49:52Z"", ""categories"": [""cs.SD"", ""eess.AS""], ""pdf_url"": ""https://arxiv.org/pdf/2310.07246v2"", ""landing_url"": ""https://arxiv.org/abs/2310.07246v2"", ""doi"": ""https://doi.org/10.48550/arXiv.2310.07246""}",2310.07246,https://openalex.org/W4387634372
10.48550/arxiv.2310.08981,Low-latency Speech Enhancement via Speech Token Generation,"Existing deep learning based speech enhancement mainly employ a data-driven approach, which leverage large amounts of data with a variety of noise types to achieve noise removal from noisy signal. However, the high dependence on the data limits its generalization on the unseen complex noises in real-life environment. In this paper, we focus on the low-latency scenario and regard speech enhancement as a speech generation problem conditioned on the noisy signal, where we generate clean speech instead of identifying and removing noises. Specifically, we propose a conditional generative framework for speech enhancement, which models clean speech by acoustic codes of a neural speech codec and generates the speech codes conditioned on past noisy frames in an auto-regressive way. Moreover, we propose an explicit-alignment approach to align noisy frames with the generated speech tokens to improve the robustness and scalability to different input lengths. Different from other methods that leverage multiple stages to generate speech codes, we leverage a single-stage speech generation approach based on the TF-Codec neural codec to achieve high speech quality with low latency. Extensive results on both synthetic and real-recorded test set show its superiority over data-driven approaches in terms of noise robustness and temporal speech coherence.",1,,include (senior:5),https://arxiv.org/abs/2310.08981v3,https://arxiv.org/pdf/2310.08981v3,2023,discrete speech tokens,speech tokens,"{""arxiv_id"": ""2310.08981"", ""title"": ""Low-latency Speech Enhancement via Speech Token Generation"", ""summary"": ""Existing deep learning based speech enhancement mainly employ a data-driven approach, which leverage large amounts of data with a variety of noise types to achieve noise removal from noisy signal. However, the high dependence on the data limits its generalization on the unseen complex noises in real-life environment. In this paper, we focus on the low-latency scenario and regard speech enhancement as a speech generation problem conditioned on the noisy signal, where we generate clean speech instead of identifying and removing noises. Specifically, we propose a conditional generative framework for speech enhancement, which models clean speech by acoustic codes of a neural speech codec and generates the speech codes conditioned on past noisy frames in an auto-regressive way. Moreover, we propose an explicit-alignment approach to align noisy frames with the generated speech tokens to improve the robustness and scalability to different input lengths. Different from other methods that leverage multiple stages to generate speech codes, we leverage a single-stage speech generation approach based on the TF-Codec neural codec to achieve high speech quality with low latency. Extensive results on both synthetic and real-recorded test set show its superiority over data-driven approaches in terms of noise robustness and temporal speech coherence."", ""authors"": [""Huaying Xue"", ""Xiulian Peng"", ""Yan Lu""], ""published"": ""2023-10-13T09:57:09Z"", ""updated"": ""2024-01-23T06:13:04Z"", ""categories"": [""cs.SD"", ""cs.MM"", ""eess.AS""], ""pdf_url"": ""https://arxiv.org/pdf/2310.08981v3"", ""landing_url"": ""https://arxiv.org/abs/2310.08981v3"", ""doi"": ""https://doi.org/10.48550/arXiv.2310.08981""}",2310.08981,https://openalex.org/W4387687749
