doi,title,abstract,included,decision_source,final_verdict,landing_url,pdf_url,year,source_anchor,source_term,metadata_json,arxiv_id,openalex_id
10.48550/arxiv.2411.17607,Scaling Speech-Text Pre-training with Synthetic Interleaved Data,"Speech language models (SpeechLMs) accept speech input and produce speech output, allowing for more natural human-computer interaction compared to text-based large language models (LLMs). Traditional approaches for developing SpeechLMs are constrained by the limited availability of unsupervised speech data and parallel speech-text data, which are significantly less abundant than text pre-training data, thereby limiting their scalability as LLMs. We propose a novel approach to scaling speech-text pre-training by leveraging large-scale synthetic interleaved data derived from text corpora, eliminating the need for parallel speech-text datasets. Our method efficiently constructs speech-text interleaved data by sampling text spans from existing text corpora and synthesizing corresponding speech spans using a text-to-token model, bypassing the need to generate actual speech. We also employ a supervised speech tokenizer derived from an automatic speech recognition (ASR) model by incorporating a vector-quantized bottleneck into the encoder. This supervised training approach results in discrete speech tokens with strong semantic preservation even at lower frame rates (e.g. 12.5Hz), while still maintaining speech reconstruction quality. Starting from a pre-trained language model and scaling our pre-training to 1 trillion tokens (with 600B synthetic interleaved speech-text data), we achieve state-of-the-art performance in speech language modeling and spoken question answering, improving performance on spoken questions tasks from the previous SOTA of 13% (Moshi) to 31%. We further demonstrate that by fine-tuning the pre-trained model with speech dialogue data, we can develop an end-to-end spoken chatbot that achieves competitive performance comparable to existing baselines in both conversational abilities and speech quality, even operating exclusively in the speech domain.",1,,include (junior:5),https://arxiv.org/abs/2411.17607v2,https://arxiv.org/pdf/2411.17607v2,2024,discrete speech tokens,speech tokens,"{""arxiv_id"": ""2411.17607"", ""title"": ""Scaling Speech-Text Pre-training with Synthetic Interleaved Data"", ""summary"": ""Speech language models (SpeechLMs) accept speech input and produce speech output, allowing for more natural human-computer interaction compared to text-based large language models (LLMs). Traditional approaches for developing SpeechLMs are constrained by the limited availability of unsupervised speech data and parallel speech-text data, which are significantly less abundant than text pre-training data, thereby limiting their scalability as LLMs. We propose a novel approach to scaling speech-text pre-training by leveraging large-scale synthetic interleaved data derived from text corpora, eliminating the need for parallel speech-text datasets. Our method efficiently constructs speech-text interleaved data by sampling text spans from existing text corpora and synthesizing corresponding speech spans using a text-to-token model, bypassing the need to generate actual speech. We also employ a supervised speech tokenizer derived from an automatic speech recognition (ASR) model by incorporating a vector-quantized bottleneck into the encoder. This supervised training approach results in discrete speech tokens with strong semantic preservation even at lower frame rates (e.g. 12.5Hz), while still maintaining speech reconstruction quality. Starting from a pre-trained language model and scaling our pre-training to 1 trillion tokens (with 600B synthetic interleaved speech-text data), we achieve state-of-the-art performance in speech language modeling and spoken question answering, improving performance on spoken questions tasks from the previous SOTA of 13% (Moshi) to 31%. We further demonstrate that by fine-tuning the pre-trained model with speech dialogue data, we can develop an end-to-end spoken chatbot that achieves competitive performance comparable to existing baselines in both conversational abilities and speech quality, even operating exclusively in the speech domain."", ""authors"": [""Aohan Zeng"", ""Zhengxiao Du"", ""Mingdao Liu"", ""Lei Zhang"", ""Shengmin Jiang"", ""Yuxiao Dong"", ""Jie Tang""], ""published"": ""2024-11-26T17:19:09Z"", ""updated"": ""2024-12-02T16:13:24Z"", ""categories"": [""cs.CL"", ""cs.SD"", ""eess.AS""], ""pdf_url"": ""https://arxiv.org/pdf/2411.17607v2"", ""landing_url"": ""https://arxiv.org/abs/2411.17607v2"", ""doi"": ""https://doi.org/10.48550/arXiv.2411.17607""}",2411.17607,https://openalex.org/W4405031987
10.48550/arxiv.2412.02612,GLM-4-Voice: Towards Intelligent and Human-Like End-to-End Spoken Chatbot,"We introduce GLM-4-Voice, an intelligent and human-like end-to-end spoken chatbot. It supports both Chinese and English, engages in real-time voice conversations, and varies vocal nuances such as emotion, intonation, speech rate, and dialect according to user instructions. GLM-4-Voice uses an ultra-low bitrate (175bps), single-codebook speech tokenizer with 12.5Hz frame rate derived from an automatic speech recognition (ASR) model by incorporating a vector-quantized bottleneck into the encoder. To efficiently transfer knowledge from text to speech modalities, we synthesize speech-text interleaved data from existing text pre-training corpora using a text-to-token model. We continue pre-training from the pre-trained text language model GLM-4-9B with a combination of unsupervised speech data, interleaved speech-text data, and supervised speech-text data, scaling up to 1 trillion tokens, achieving state-of-the-art performance in both speech language modeling and spoken question answering. We then fine-tune the pre-trained model with high-quality conversational speech data, achieving superior performance compared to existing baselines in both conversational ability and speech quality. The open models can be accessed through https://github.com/THUDM/GLM-4-Voice and https://huggingface.co/THUDM/glm-4-voice-9b.",1,,include (junior:5),https://arxiv.org/abs/2412.02612v1,https://arxiv.org/pdf/2412.02612v1,2024,discrete speech tokens,speech tokenizer,"{""arxiv_id"": ""2412.02612"", ""title"": ""GLM-4-Voice: Towards Intelligent and Human-Like End-to-End Spoken Chatbot"", ""summary"": ""We introduce GLM-4-Voice, an intelligent and human-like end-to-end spoken chatbot. It supports both Chinese and English, engages in real-time voice conversations, and varies vocal nuances such as emotion, intonation, speech rate, and dialect according to user instructions. GLM-4-Voice uses an ultra-low bitrate (175bps), single-codebook speech tokenizer with 12.5Hz frame rate derived from an automatic speech recognition (ASR) model by incorporating a vector-quantized bottleneck into the encoder. To efficiently transfer knowledge from text to speech modalities, we synthesize speech-text interleaved data from existing text pre-training corpora using a text-to-token model. We continue pre-training from the pre-trained text language model GLM-4-9B with a combination of unsupervised speech data, interleaved speech-text data, and supervised speech-text data, scaling up to 1 trillion tokens, achieving state-of-the-art performance in both speech language modeling and spoken question answering. We then fine-tune the pre-trained model with high-quality conversational speech data, achieving superior performance compared to existing baselines in both conversational ability and speech quality. The open models can be accessed through https://github.com/THUDM/GLM-4-Voice and https://huggingface.co/THUDM/glm-4-voice-9b."", ""authors"": [""Aohan Zeng"", ""Zhengxiao Du"", ""Mingdao Liu"", ""Kedong Wang"", ""Shengmin Jiang"", ""Lei Zhao"", ""Yuxiao Dong"", ""Jie Tang""], ""published"": ""2024-12-03T17:41:24Z"", ""updated"": ""2024-12-03T17:41:24Z"", ""categories"": [""cs.CL"", ""cs.SD"", ""eess.AS""], ""pdf_url"": ""https://arxiv.org/pdf/2412.02612v1"", ""landing_url"": ""https://arxiv.org/abs/2412.02612v1"", ""doi"": ""https://doi.org/10.48550/arXiv.2412.02612""}",2412.02612,https://openalex.org/W4405057125
10.48550/arxiv.2412.10117,CosyVoice 2: Scalable Streaming Speech Synthesis with Large Language Models,"In our previous work, we introduced CosyVoice, a multilingual speech synthesis model based on supervised discrete speech tokens. By employing progressive semantic decoding with two popular generative models, language models (LMs) and Flow Matching, CosyVoice demonstrated high prosody naturalness, content consistency, and speaker similarity in speech in-context learning. Recently, significant progress has been made in multi-modal large language models (LLMs), where the response latency and real-time factor of speech synthesis play a crucial role in the interactive experience. Therefore, in this report, we present an improved streaming speech synthesis model, CosyVoice 2, which incorporates comprehensive and systematic optimizations. Specifically, we introduce finite-scalar quantization to improve the codebook utilization of speech tokens. For the text-speech LM, we streamline the model architecture to allow direct use of a pre-trained LLM as the backbone. In addition, we develop a chunk-aware causal flow matching model to support various synthesis scenarios, enabling both streaming and non-streaming synthesis within a single model. By training on a large-scale multilingual dataset, CosyVoice 2 achieves human-parity naturalness, minimal response latency, and virtually lossless synthesis quality in the streaming mode. We invite readers to listen to the demos at https://funaudiollm.github.io/cosyvoice2.",1,,include (junior:4),https://arxiv.org/abs/2412.10117v3,https://arxiv.org/pdf/2412.10117v3,2024,discrete speech tokens,speech tokens,"{""arxiv_id"": ""2412.10117"", ""title"": ""CosyVoice 2: Scalable Streaming Speech Synthesis with Large Language Models"", ""summary"": ""In our previous work, we introduced CosyVoice, a multilingual speech synthesis model based on supervised discrete speech tokens. By employing progressive semantic decoding with two popular generative models, language models (LMs) and Flow Matching, CosyVoice demonstrated high prosody naturalness, content consistency, and speaker similarity in speech in-context learning. Recently, significant progress has been made in multi-modal large language models (LLMs), where the response latency and real-time factor of speech synthesis play a crucial role in the interactive experience. Therefore, in this report, we present an improved streaming speech synthesis model, CosyVoice 2, which incorporates comprehensive and systematic optimizations. Specifically, we introduce finite-scalar quantization to improve the codebook utilization of speech tokens. For the text-speech LM, we streamline the model architecture to allow direct use of a pre-trained LLM as the backbone. In addition, we develop a chunk-aware causal flow matching model to support various synthesis scenarios, enabling both streaming and non-streaming synthesis within a single model. By training on a large-scale multilingual dataset, CosyVoice 2 achieves human-parity naturalness, minimal response latency, and virtually lossless synthesis quality in the streaming mode. We invite readers to listen to the demos at https://funaudiollm.github.io/cosyvoice2."", ""authors"": [""Zhihao Du"", ""Yuxuan Wang"", ""Qian Chen"", ""Xian Shi"", ""Xiang Lv"", ""Tianyu Zhao"", ""Zhifu Gao"", ""Yexin Yang"", ""Changfeng Gao"", ""Hui Wang"", ""Fan Yu"", ""Huadai Liu"", ""Zhengyan Sheng"", ""Yue Gu"", ""Chong Deng"", ""Wen Wang"", ""Shiliang Zhang"", ""Zhijie Yan"", ""Jingren Zhou""], ""published"": ""2024-12-13T12:59:39Z"", ""updated"": ""2024-12-25T11:54:03Z"", ""categories"": [""cs.SD"", ""cs.AI"", ""cs.LG"", ""eess.AS""], ""pdf_url"": ""https://arxiv.org/pdf/2412.10117v3"", ""landing_url"": ""https://arxiv.org/abs/2412.10117v3"", ""doi"": ""https://doi.org/10.48550/arXiv.2412.10117""}",2412.10117,https://openalex.org/W4405433404
10.48550/arxiv.2412.11449,Whisper-GPT: A Hybrid Representation Audio Large Language Model,"We propose WHISPER-GPT: A generative large language model (LLM) for speech and music that allows us to work with continuous audio representations and discrete tokens simultaneously as part of a single architecture. There has been a huge surge in generative audio, speech, and music models that utilize discrete audio tokens derived from neural compression algorithms, e.g. ENCODEC. However, one of the major drawbacks of this approach is handling the context length. It blows up for high-fidelity generative architecture if one has to account for all the audio contents at various frequencies for the next token prediction. By combining continuous audio representation like the spectrogram and discrete acoustic tokens, we retain the best of both worlds: Have all the information needed from the audio at a specific time instance in a single token, yet allow LLM to predict the future token to allow for sampling and other benefits discrete space provides. We show how our architecture improves the perplexity and negative log-likelihood scores for the next token prediction compared to a token-based LLM for speech and music.",1,,include (junior:4),https://arxiv.org/abs/2412.11449v1,https://arxiv.org/pdf/2412.11449v1,2024,acoustic tokens,offline clustering,"{""arxiv_id"": ""2412.11449"", ""title"": ""Whisper-GPT: A Hybrid Representation Audio Large Language Model"", ""summary"": ""We propose WHISPER-GPT: A generative large language model (LLM) for speech and music that allows us to work with continuous audio representations and discrete tokens simultaneously as part of a single architecture. There has been a huge surge in generative audio, speech, and music models that utilize discrete audio tokens derived from neural compression algorithms, e.g. ENCODEC. However, one of the major drawbacks of this approach is handling the context length. It blows up for high-fidelity generative architecture if one has to account for all the audio contents at various frequencies for the next token prediction. By combining continuous audio representation like the spectrogram and discrete acoustic tokens, we retain the best of both worlds: Have all the information needed from the audio at a specific time instance in a single token, yet allow LLM to predict the future token to allow for sampling and other benefits discrete space provides. We show how our architecture improves the perplexity and negative log-likelihood scores for the next token prediction compared to a token-based LLM for speech and music."", ""authors"": [""Prateek Verma""], ""published"": ""2024-12-16T05:03:48Z"", ""updated"": ""2024-12-16T05:03:48Z"", ""categories"": [""cs.SD"", ""cs.AI"", ""cs.CL"", ""cs.LG"", ""eess.AS""], ""pdf_url"": ""https://arxiv.org/pdf/2412.11449v1"", ""landing_url"": ""https://arxiv.org/abs/2412.11449v1"", ""doi"": ""https://doi.org/10.48550/arXiv.2412.11449""}",2412.11449,https://openalex.org/W4405470171
10.48550/arxiv.2412.15649,SLAM-Omni: Timbre-Controllable Voice Interaction System with Single-Stage Training,"Recent advancements highlight the potential of end-to-end real-time spoken dialogue systems, showcasing their low latency and high quality. In this paper, we introduce SLAM-Omni, a timbre-controllable, end-to-end voice interaction system with single-stage training. SLAM-Omni achieves zero-shot timbre control by modeling spoken language with semantic tokens and decoupling speaker information to a vocoder. By predicting grouped speech semantic tokens at each step, our method significantly reduces the sequence length of audio tokens, accelerating both training and inference. Additionally, we propose historical text prompting to compress dialogue history, facilitating efficient multi-round interactions. Comprehensive evaluations reveal that SLAM-Omni outperforms prior models of similar scale, requiring only 15 hours of training on 4 GPUs with limited data. Notably, it is the first spoken dialogue system to achieve competitive performance with a single-stage training approach, eliminating the need for pre-training on TTS or ASR tasks. Further experiments validate its multilingual and multi-turn dialogue capabilities on larger datasets.",1,,include (junior:4),https://arxiv.org/abs/2412.15649v1,https://arxiv.org/pdf/2412.15649v1,2024,semantic tokens,speech tokenization,"{""arxiv_id"": ""2412.15649"", ""title"": ""SLAM-Omni: Timbre-Controllable Voice Interaction System with Single-Stage Training"", ""summary"": ""Recent advancements highlight the potential of end-to-end real-time spoken dialogue systems, showcasing their low latency and high quality. In this paper, we introduce SLAM-Omni, a timbre-controllable, end-to-end voice interaction system with single-stage training. SLAM-Omni achieves zero-shot timbre control by modeling spoken language with semantic tokens and decoupling speaker information to a vocoder. By predicting grouped speech semantic tokens at each step, our method significantly reduces the sequence length of audio tokens, accelerating both training and inference. Additionally, we propose historical text prompting to compress dialogue history, facilitating efficient multi-round interactions. Comprehensive evaluations reveal that SLAM-Omni outperforms prior models of similar scale, requiring only 15 hours of training on 4 GPUs with limited data. Notably, it is the first spoken dialogue system to achieve competitive performance with a single-stage training approach, eliminating the need for pre-training on TTS or ASR tasks. Further experiments validate its multilingual and multi-turn dialogue capabilities on larger datasets."", ""authors"": [""Wenxi Chen"", ""Ziyang Ma"", ""Ruiqi Yan"", ""Yuzhe Liang"", ""Xiquan Li"", ""Ruiyang Xu"", ""Zhikang Niu"", ""Yanqiao Zhu"", ""Yifan Yang"", ""Zhanxun Liu"", ""Kai Yu"", ""Yuxuan Hu"", ""Jinyu Li"", ""Yan Lu"", ""Shujie Liu"", ""Xie Chen""], ""published"": ""2024-12-20T08:05:55Z"", ""updated"": ""2024-12-20T08:05:55Z"", ""categories"": [""eess.AS""], ""pdf_url"": ""https://arxiv.org/pdf/2412.15649v1"", ""landing_url"": ""https://arxiv.org/abs/2412.15649v1"", ""doi"": ""https://doi.org/10.48550/arXiv.2412.15649""}",2412.15649,https://openalex.org/W4405714880
10.48550/arxiv.2412.19248,Causal Speech Enhancement with Predicting Semantics based on Quantized Self-supervised Learning Features,"Real-time speech enhancement (SE) is essential to online speech communication. Causal SE models use only the previous context while predicting future information, such as phoneme continuation, may help performing causal SE. The phonetic information is often represented by quantizing latent features of self-supervised learning (SSL) models. This work is the first to incorporate SSL features with causality into an SE model. The causal SSL features are encoded and combined with spectrogram features using feature-wise linear modulation to estimate a mask for enhancing the noisy input speech. Simultaneously, we quantize the causal SSL features using vector quantization to represent phonetic characteristics as semantic tokens. The model not only encodes SSL features but also predicts the future semantic tokens in multi-task learning (MTL). The experimental results using VoiceBank + DEMAND dataset show that our proposed method achieves 2.88 in PESQ, especially with semantic prediction MTL, in which we confirm that the semantic prediction played an important role in causal SE.",1,,include (junior:5),https://arxiv.org/abs/2412.19248v1,https://arxiv.org/pdf/2412.19248v1,2024,semantic tokens,speech tokenization,"{""arxiv_id"": ""2412.19248"", ""title"": ""Causal Speech Enhancement with Predicting Semantics based on Quantized Self-supervised Learning Features"", ""summary"": ""Real-time speech enhancement (SE) is essential to online speech communication. Causal SE models use only the previous context while predicting future information, such as phoneme continuation, may help performing causal SE. The phonetic information is often represented by quantizing latent features of self-supervised learning (SSL) models. This work is the first to incorporate SSL features with causality into an SE model. The causal SSL features are encoded and combined with spectrogram features using feature-wise linear modulation to estimate a mask for enhancing the noisy input speech. Simultaneously, we quantize the causal SSL features using vector quantization to represent phonetic characteristics as semantic tokens. The model not only encodes SSL features but also predicts the future semantic tokens in multi-task learning (MTL). The experimental results using VoiceBank + DEMAND dataset show that our proposed method achieves 2.88 in PESQ, especially with semantic prediction MTL, in which we confirm that the semantic prediction played an important role in causal SE."", ""authors"": [""Emiru Tsunoo"", ""Yuki Saito"", ""Wataru Nakata"", ""Hiroshi Saruwatari""], ""published"": ""2024-12-26T15:08:36Z"", ""updated"": ""2024-12-26T15:08:36Z"", ""categories"": [""eess.AS"", ""cs.SD""], ""pdf_url"": ""https://arxiv.org/pdf/2412.19248v1"", ""landing_url"": ""https://arxiv.org/abs/2412.19248v1"", ""doi"": ""https://doi.org/10.48550/arXiv.2412.19248""}",2412.19248,https://openalex.org/W4405902171
10.48550/arxiv.2501.00018,SECodec: Structural Entropy-based Compressive Speech Representation Codec for Speech Language Models,"With the rapid advancement of large language models (LLMs), discrete speech representations have become crucial for integrating speech into LLMs. Existing methods for speech representation discretization rely on a predefined codebook size and Euclidean distance-based quantization. However, 1) the size of codebook is a critical parameter that affects both codec performance and downstream task training efficiency. 2) The Euclidean distance-based quantization may lead to audio distortion when the size of the codebook is controlled within a reasonable range. In fact, in the field of information compression, structural information and entropy guidance are crucial, but previous methods have largely overlooked these factors. Therefore, we address the above issues from an information-theoretic perspective, we present SECodec, a novel speech representation codec based on structural entropy (SE) for building speech language models. Specifically, we first model speech as a graph, clustering the speech features nodes within the graph and extracting the corresponding codebook by hierarchically and disentangledly minimizing 2D SE. Then, to address the issue of audio distortion, we propose a new quantization method. This method still adheres to the 2D SE minimization principle, adaptively selecting the most suitable token corresponding to the cluster for each incoming original speech node. Furthermore, we develop a Structural Entropy-based Speech Language Model (SESLM) that leverages SECodec. Experimental results demonstrate that SECodec performs comparably to EnCodec in speech reconstruction, and SESLM surpasses VALL-E in zero-shot text-to-speech tasks. Code, demo speeches, speech feature graph, SE codebook, and models are available at https://github.com/wlq2019/SECodec.",1,,include (junior:5),https://arxiv.org/abs/2501.00018v1,https://arxiv.org/pdf/2501.00018v1,2024,speech representation,speech tokens,"{""arxiv_id"": ""2501.00018"", ""title"": ""SECodec: Structural Entropy-based Compressive Speech Representation Codec for Speech Language Models"", ""summary"": ""With the rapid advancement of large language models (LLMs), discrete speech representations have become crucial for integrating speech into LLMs. Existing methods for speech representation discretization rely on a predefined codebook size and Euclidean distance-based quantization. However, 1) the size of codebook is a critical parameter that affects both codec performance and downstream task training efficiency. 2) The Euclidean distance-based quantization may lead to audio distortion when the size of the codebook is controlled within a reasonable range. In fact, in the field of information compression, structural information and entropy guidance are crucial, but previous methods have largely overlooked these factors. Therefore, we address the above issues from an information-theoretic perspective, we present SECodec, a novel speech representation codec based on structural entropy (SE) for building speech language models. Specifically, we first model speech as a graph, clustering the speech features nodes within the graph and extracting the corresponding codebook by hierarchically and disentangledly minimizing 2D SE. Then, to address the issue of audio distortion, we propose a new quantization method. This method still adheres to the 2D SE minimization principle, adaptively selecting the most suitable token corresponding to the cluster for each incoming original speech node. Furthermore, we develop a Structural Entropy-based Speech Language Model (SESLM) that leverages SECodec. Experimental results demonstrate that SECodec performs comparably to EnCodec in speech reconstruction, and SESLM surpasses VALL-E in zero-shot text-to-speech tasks. Code, demo speeches, speech feature graph, SE codebook, and models are available at https://github.com/wlq2019/SECodec."", ""authors"": [""Linqin Wang"", ""Yaping Liu"", ""Zhengtao Yu"", ""Shengxiang Gao"", ""Cunli Mao"", ""Yuxin Huang"", ""Wenjun Wang"", ""Ling Dong""], ""published"": ""2024-12-16T03:33:05Z"", ""updated"": ""2024-12-16T03:33:05Z"", ""categories"": [""cs.SD"", ""eess.AS""], ""pdf_url"": ""https://arxiv.org/pdf/2501.00018v1"", ""landing_url"": ""https://arxiv.org/abs/2501.00018v1"", ""doi"": ""https://doi.org/10.48550/arXiv.2501.00018""}",2501.00018,https://openalex.org/W4406051734
