doi,title,abstract,included,decision_source,final_verdict,landing_url,pdf_url,year,source_anchor,source_term,metadata_json,arxiv_id,openalex_id
10.48550/arxiv.2502.06490,Recent Advances in Discrete Speech Tokens: A Review,"The rapid advancement of speech generation technologies in the era of large language models (LLMs) has established discrete speech tokens as a foundational paradigm for speech representation. These tokens, characterized by their discrete, compact, and concise nature, are not only advantageous for efficient transmission and storage, but also inherently compatible with the language modeling framework, enabling seamless integration of speech into text-dominated LLM architectures. Current research categorizes discrete speech tokens into two principal classes: acoustic tokens and semantic tokens, each of which has evolved into a rich research domain characterized by unique design philosophies and methodological approaches. This survey systematically synthesizes the existing taxonomy and recent innovations in discrete speech tokenization, conducts a critical examination of the strengths and limitations of each paradigm, and presents systematic experimental comparisons across token types. Furthermore, we identify persistent challenges in the field and propose potential research directions, aiming to offer actionable insights to inspire future advancements in the development and application of discrete speech tokens.",1,,include (seed_filter),https://arxiv.org/abs/2502.06490v4,https://arxiv.org/pdf/2502.06490v4,2025,discrete speech tokens,speech tokens,"{""arxiv_id"": ""2502.06490"", ""title"": ""Recent Advances in Discrete Speech Tokens: A Review"", ""summary"": ""The rapid advancement of speech generation technologies in the era of large language models (LLMs) has established discrete speech tokens as a foundational paradigm for speech representation. These tokens, characterized by their discrete, compact, and concise nature, are not only advantageous for efficient transmission and storage, but also inherently compatible with the language modeling framework, enabling seamless integration of speech into text-dominated LLM architectures. Current research categorizes discrete speech tokens into two principal classes: acoustic tokens and semantic tokens, each of which has evolved into a rich research domain characterized by unique design philosophies and methodological approaches. This survey systematically synthesizes the existing taxonomy and recent innovations in discrete speech tokenization, conducts a critical examination of the strengths and limitations of each paradigm, and presents systematic experimental comparisons across token types. Furthermore, we identify persistent challenges in the field and propose potential research directions, aiming to offer actionable insights to inspire future advancements in the development and application of discrete speech tokens."", ""authors"": [""Yiwei Guo"", ""Zhihan Li"", ""Hankun Wang"", ""Bohan Li"", ""Chongtian Shao"", ""Hanglei Zhang"", ""Chenpeng Du"", ""Xie Chen"", ""Shujie Liu"", ""Kai Yu""], ""published"": ""2025-02-10T14:08:25Z"", ""updated"": ""2025-12-12T05:18:11Z"", ""categories"": [""eess.AS"", ""cs.AI"", ""cs.MM"", ""cs.SD"", ""eess.SP""], ""pdf_url"": ""https://arxiv.org/pdf/2502.06490v4"", ""landing_url"": ""https://arxiv.org/abs/2502.06490v4"", ""doi"": ""https://doi.org/10.48550/arXiv.2502.06490""}",2502.0649,https://openalex.org/W4407359094
10.48550/arxiv.2206.08790,Self-supervised speech unit discovery from articulatory and acoustic features using VQ-VAE,"The human perception system is often assumed to recruit motor knowledge when processing auditory speech inputs. Using articulatory modeling and deep learning, this study examines how this articulatory information can be used for discovering speech units in a self-supervised setting. We used vector-quantized variational autoencoders (VQ-VAE) to learn discrete representations from articulatory and acoustic speech data. In line with the zero-resource paradigm, an ABX test was then used to investigate how the extracted representations encode phonetically relevant properties. Experiments were conducted on three different corpora in English and French. We found that articulatory information rather organises the latent representations in terms of place of articulation whereas the speech acoustics mainly structure the latent space in terms of manner of articulation. We show that an optimal fusion of the two modalities can lead to a joint representation of these phonetic dimensions more accurate than each modality considered individually. Since articulatory information is usually not available in a practical situation, we finally investigate the benefit it provides when inferred from the speech acoustics in a self-supervised manner.",1,,include (junior:5),https://arxiv.org/abs/2206.08790v1,https://arxiv.org/pdf/2206.08790v1,2022,discrete speech tokens,vq vae,"{""arxiv_id"": ""2206.08790"", ""title"": ""Self-supervised speech unit discovery from articulatory and acoustic features using VQ-VAE"", ""summary"": ""The human perception system is often assumed to recruit motor knowledge when processing auditory speech inputs. Using articulatory modeling and deep learning, this study examines how this articulatory information can be used for discovering speech units in a self-supervised setting. We used vector-quantized variational autoencoders (VQ-VAE) to learn discrete representations from articulatory and acoustic speech data. In line with the zero-resource paradigm, an ABX test was then used to investigate how the extracted representations encode phonetically relevant properties. Experiments were conducted on three different corpora in English and French. We found that articulatory information rather organises the latent representations in terms of place of articulation whereas the speech acoustics mainly structure the latent space in terms of manner of articulation. We show that an optimal fusion of the two modalities can lead to a joint representation of these phonetic dimensions more accurate than each modality considered individually. Since articulatory information is usually not available in a practical situation, we finally investigate the benefit it provides when inferred from the speech acoustics in a self-supervised manner."", ""authors"": [""Marc-Antoine Georges"", ""Jean-Luc Schwartz"", ""Thomas Hueber""], ""published"": ""2022-06-17T14:04:24Z"", ""updated"": ""2022-06-17T14:04:24Z"", ""categories"": [""cs.CL""], ""pdf_url"": ""https://arxiv.org/pdf/2206.08790v1"", ""landing_url"": ""https://arxiv.org/abs/2206.08790v1"", ""doi"": ""https://doi.org/10.48550/arXiv.2206.08790""}",2206.0879,https://openalex.org/W4283207314
10.1109/jstsp.2022.3193761,A Comparative Study of Self-supervised Speech Representation Based Voice Conversion,"We present a large-scale comparative study of self-supervised speech representation (S3R)-based voice conversion (VC). In the context of recognition-synthesis VC, S3Rs are attractive owing to their potential to replace expensive supervised representations such as phonetic posteriorgrams (PPGs), which are commonly adopted by state-of-the-art VC systems. Using S3PRL-VC, an open-source VC software we previously developed, we provide a series of in-depth objective and subjective analyses under three VC settings: intra-/cross-lingual any-to-one (A2O) and any-to-any (A2A) VC, using the voice conversion challenge 2020 (VCC2020) dataset. We investigated S3R-based VC in various aspects, including model type, multilinguality, and supervision. We also studied the effect of a post-discretization process with k-means clustering and showed how it improves in the A2A setting. Finally, the comparison with state-of-the-art VC systems demonstrates the competitiveness of S3R-based VC and also sheds light on the possible improving directions.",1,,include (senior:4),https://arxiv.org/abs/2207.04356v1,https://arxiv.org/pdf/2207.04356v1,2022,speech representation,speech tokens,"{""arxiv_id"": ""2207.04356"", ""title"": ""A Comparative Study of Self-supervised Speech Representation Based Voice Conversion"", ""summary"": ""We present a large-scale comparative study of self-supervised speech representation (S3R)-based voice conversion (VC). In the context of recognition-synthesis VC, S3Rs are attractive owing to their potential to replace expensive supervised representations such as phonetic posteriorgrams (PPGs), which are commonly adopted by state-of-the-art VC systems. Using S3PRL-VC, an open-source VC software we previously developed, we provide a series of in-depth objective and subjective analyses under three VC settings: intra-/cross-lingual any-to-one (A2O) and any-to-any (A2A) VC, using the voice conversion challenge 2020 (VCC2020) dataset. We investigated S3R-based VC in various aspects, including model type, multilinguality, and supervision. We also studied the effect of a post-discretization process with k-means clustering and showed how it improves in the A2A setting. Finally, the comparison with state-of-the-art VC systems demonstrates the competitiveness of S3R-based VC and also sheds light on the possible improving directions."", ""authors"": [""Wen-Chin Huang"", ""Shu-Wen Yang"", ""Tomoki Hayashi"", ""Tomoki Toda""], ""published"": ""2022-07-10T01:02:22Z"", ""updated"": ""2022-07-10T01:02:22Z"", ""categories"": [""cs.SD"", ""cs.LG"", ""eess.AS""], ""pdf_url"": ""https://arxiv.org/pdf/2207.04356v1"", ""landing_url"": ""https://arxiv.org/abs/2207.04356v1"", ""doi"": ""https://doi.org/10.1109/JSTSP.2022.3193761""}",2207.04356,https://openalex.org/W4287889585
10.48550/arxiv.2207.04646,DelightfulTTS 2: End-to-End Speech Synthesis with Adversarial Vector-Quantized Auto-Encoders,"Current text to speech (TTS) systems usually leverage a cascaded acoustic model and vocoder pipeline with mel-spectrograms as the intermediate representations, which suffer from two limitations: 1) the acoustic model and vocoder are separately trained instead of jointly optimized, which incurs cascaded errors; 2) the intermediate speech representations (e.g., mel-spectrogram) are pre-designed and lose phase information, which are sub-optimal. To solve these problems, in this paper, we develop DelightfulTTS 2, a new end-to-end speech synthesis system with automatically learned speech representations and jointly optimized acoustic model and vocoder. Specifically, 1) we propose a new codec network based on vector-quantized auto-encoders with adversarial training (VQ-GAN) to extract intermediate frame-level speech representations (instead of traditional representations like mel-spectrograms) and reconstruct speech waveform; 2) we jointly optimize the acoustic model (based on DelightfulTTS) and the vocoder (the decoder of VQ-GAN), with an auxiliary loss on the acoustic model to predict intermediate speech representations. Experiments show that DelightfulTTS 2 achieves a CMOS gain +0.14 over DelightfulTTS, and more method analyses further verify the effectiveness of the developed system.",1,,include (junior:4),https://arxiv.org/abs/2207.04646v1,https://arxiv.org/pdf/2207.04646v1,2022,discrete speech tokens,vq gan,"{""arxiv_id"": ""2207.04646"", ""title"": ""DelightfulTTS 2: End-to-End Speech Synthesis with Adversarial Vector-Quantized Auto-Encoders"", ""summary"": ""Current text to speech (TTS) systems usually leverage a cascaded acoustic model and vocoder pipeline with mel-spectrograms as the intermediate representations, which suffer from two limitations: 1) the acoustic model and vocoder are separately trained instead of jointly optimized, which incurs cascaded errors; 2) the intermediate speech representations (e.g., mel-spectrogram) are pre-designed and lose phase information, which are sub-optimal. To solve these problems, in this paper, we develop DelightfulTTS 2, a new end-to-end speech synthesis system with automatically learned speech representations and jointly optimized acoustic model and vocoder. Specifically, 1) we propose a new codec network based on vector-quantized auto-encoders with adversarial training (VQ-GAN) to extract intermediate frame-level speech representations (instead of traditional representations like mel-spectrograms) and reconstruct speech waveform; 2) we jointly optimize the acoustic model (based on DelightfulTTS) and the vocoder (the decoder of VQ-GAN), with an auxiliary loss on the acoustic model to predict intermediate speech representations. Experiments show that DelightfulTTS 2 achieves a CMOS gain +0.14 over DelightfulTTS, and more method analyses further verify the effectiveness of the developed system."", ""authors"": [""Yanqing Liu"", ""Ruiqing Xue"", ""Lei He"", ""Xu Tan"", ""Sheng Zhao""], ""published"": ""2022-07-11T06:15:45Z"", ""updated"": ""2022-07-11T06:15:45Z"", ""categories"": [""cs.SD"", ""eess.AS"", ""eess.SP""], ""pdf_url"": ""https://arxiv.org/pdf/2207.04646v1"", ""landing_url"": ""https://arxiv.org/abs/2207.04646v1"", ""doi"": ""https://doi.org/10.48550/arXiv.2207.04646""}",2207.04646,https://openalex.org/W4285077573
10.48550/arxiv.2209.10887,A Multi-Stage Multi-Codebook VQ-VAE Approach to High-Performance Neural TTS,"We propose a Multi-Stage, Multi-Codebook (MSMC) approach to high-performance neural TTS synthesis. A vector-quantized, variational autoencoder (VQ-VAE) based feature analyzer is used to encode Mel spectrograms of speech training data by down-sampling progressively in multiple stages into MSMC Representations (MSMCRs) with different time resolutions, and quantizing them with multiple VQ codebooks, respectively. Multi-stage predictors are trained to map the input text sequence to MSMCRs progressively by minimizing a combined loss of the reconstruction Mean Square Error (MSE) and ""triplet loss"". In synthesis, the neural vocoder converts the predicted MSMCRs into final speech waveforms. The proposed approach is trained and tested with an English TTS database of 16 hours by a female speaker. The proposed TTS achieves an MOS score of 4.41, which outperforms the baseline with an MOS of 3.62. Compact versions of the proposed TTS with much less parameters can still preserve high MOS scores. Ablation studies show that both multiple stages and multiple codebooks are effective for achieving high TTS performance.",1,,include (junior:5),https://arxiv.org/abs/2209.10887v1,https://arxiv.org/pdf/2209.10887v1,2022,discrete speech tokens,vq vae,"{""arxiv_id"": ""2209.10887"", ""title"": ""A Multi-Stage Multi-Codebook VQ-VAE Approach to High-Performance Neural TTS"", ""summary"": ""We propose a Multi-Stage, Multi-Codebook (MSMC) approach to high-performance neural TTS synthesis. A vector-quantized, variational autoencoder (VQ-VAE) based feature analyzer is used to encode Mel spectrograms of speech training data by down-sampling progressively in multiple stages into MSMC Representations (MSMCRs) with different time resolutions, and quantizing them with multiple VQ codebooks, respectively. Multi-stage predictors are trained to map the input text sequence to MSMCRs progressively by minimizing a combined loss of the reconstruction Mean Square Error (MSE) and \""triplet loss\"". In synthesis, the neural vocoder converts the predicted MSMCRs into final speech waveforms. The proposed approach is trained and tested with an English TTS database of 16 hours by a female speaker. The proposed TTS achieves an MOS score of 4.41, which outperforms the baseline with an MOS of 3.62. Compact versions of the proposed TTS with much less parameters can still preserve high MOS scores. Ablation studies show that both multiple stages and multiple codebooks are effective for achieving high TTS performance."", ""authors"": [""Haohan Guo"", ""Fenglong Xie"", ""Frank K. Soong"", ""Xixin Wu"", ""Helen Meng""], ""published"": ""2022-09-22T09:43:17Z"", ""updated"": ""2022-09-22T09:43:17Z"", ""categories"": [""cs.SD"", ""cs.CL"", ""eess.AS""], ""pdf_url"": ""https://arxiv.org/pdf/2209.10887v1"", ""landing_url"": ""https://arxiv.org/abs/2209.10887v1"", ""doi"": ""https://doi.org/10.48550/arXiv.2209.10887""}",2209.10887,https://openalex.org/W4296972946
10.48550/arxiv.2210.04062,CoBERT: Self-Supervised Speech Representation Learning Through Code Representation Learning,"Speech is the surface form of a finite set of phonetic units, which can be represented by discrete codes. We propose the Code BERT (CoBERT) approach for self-supervised speech representation learning. The idea is to convert an utterance to a sequence of discrete codes, and perform code representation learning, where we predict the code representations based on a masked view of the original speech input. Unlike the prior self-distillation approaches of which the teacher and the student are of the same modality, our target model predicts representations from a different modality. CoBERT outperforms the most recent state-of-the-art performance on the ASR task and brings significant improvements on the SUPERB speech translation (ST) task. Our code and models are released at https://github.com/mct10/CoBERT.",1,,include (junior:5),https://arxiv.org/abs/2210.04062v3,https://arxiv.org/pdf/2210.04062v3,2022,speech representation,speech tokens,"{""arxiv_id"": ""2210.04062"", ""title"": ""CoBERT: Self-Supervised Speech Representation Learning Through Code Representation Learning"", ""summary"": ""Speech is the surface form of a finite set of phonetic units, which can be represented by discrete codes. We propose the Code BERT (CoBERT) approach for self-supervised speech representation learning. The idea is to convert an utterance to a sequence of discrete codes, and perform code representation learning, where we predict the code representations based on a masked view of the original speech input. Unlike the prior self-distillation approaches of which the teacher and the student are of the same modality, our target model predicts representations from a different modality. CoBERT outperforms the most recent state-of-the-art performance on the ASR task and brings significant improvements on the SUPERB speech translation (ST) task. Our code and models are released at https://github.com/mct10/CoBERT."", ""authors"": [""Chutong Meng"", ""Junyi Ao"", ""Tom Ko"", ""Mingxuan Wang"", ""Haizhou Li""], ""published"": ""2022-10-08T17:15:46Z"", ""updated"": ""2023-07-05T16:30:48Z"", ""categories"": [""cs.SD"", ""eess.AS""], ""pdf_url"": ""https://arxiv.org/pdf/2210.04062v3"", ""landing_url"": ""https://arxiv.org/abs/2210.04062v3"", ""doi"": ""https://doi.org/10.48550/arXiv.2210.04062""}",2210.04062,https://openalex.org/W4304701018
10.48550/arxiv.2210.06007,JukeDrummer: Conditional Beat-aware Audio-domain Drum Accompaniment Generation via Transformer VQ-VAE,"This paper proposes a model that generates a drum track in the audio domain to play along to a user-provided drum-free recording. Specifically, using paired data of drumless tracks and the corresponding human-made drum tracks, we train a Transformer model to improvise the drum part of an unseen drumless recording. We combine two approaches to encode the input audio. First, we train a vector-quantized variational autoencoder (VQ-VAE) to represent the input audio with discrete codes, which can then be readily used in a Transformer. Second, using an audio-domain beat tracking model, we compute beat-related features of the input audio and use them as embeddings in the Transformer. Instead of generating the drum track directly as waveforms, we use a separate VQ-VAE to encode the mel-spectrogram of a drum track into another set of discrete codes, and train the Transformer to predict the sequence of drum-related discrete codes. The output codes are then converted to a mel-spectrogram with a decoder, and then to the waveform with a vocoder. We report both objective and subjective evaluations of variants of the proposed model, demonstrating that the model with beat information generates drum accompaniment that is rhythmically and stylistically consistent with the input audio.",1,,include (junior:5),https://arxiv.org/abs/2210.06007v2,https://arxiv.org/pdf/2210.06007v2,2022,discrete speech tokens,vq vae,"{""arxiv_id"": ""2210.06007"", ""title"": ""JukeDrummer: Conditional Beat-aware Audio-domain Drum Accompaniment Generation via Transformer VQ-VAE"", ""summary"": ""This paper proposes a model that generates a drum track in the audio domain to play along to a user-provided drum-free recording. Specifically, using paired data of drumless tracks and the corresponding human-made drum tracks, we train a Transformer model to improvise the drum part of an unseen drumless recording. We combine two approaches to encode the input audio. First, we train a vector-quantized variational autoencoder (VQ-VAE) to represent the input audio with discrete codes, which can then be readily used in a Transformer. Second, using an audio-domain beat tracking model, we compute beat-related features of the input audio and use them as embeddings in the Transformer. Instead of generating the drum track directly as waveforms, we use a separate VQ-VAE to encode the mel-spectrogram of a drum track into another set of discrete codes, and train the Transformer to predict the sequence of drum-related discrete codes. The output codes are then converted to a mel-spectrogram with a decoder, and then to the waveform with a vocoder. We report both objective and subjective evaluations of variants of the proposed model, demonstrating that the model with beat information generates drum accompaniment that is rhythmically and stylistically consistent with the input audio."", ""authors"": [""Yueh-Kao Wu"", ""Ching-Yu Chiu"", ""Yi-Hsuan Yang""], ""published"": ""2022-10-12T08:23:20Z"", ""updated"": ""2022-10-31T08:54:08Z"", ""categories"": [""cs.SD"", ""cs.AI"", ""cs.LG"", ""eess.AS""], ""pdf_url"": ""https://arxiv.org/pdf/2210.06007v2"", ""landing_url"": ""https://arxiv.org/abs/2210.06007v2"", ""doi"": ""https://doi.org/10.48550/arXiv.2210.06007""}",2210.06007,https://openalex.org/W4306177919
10.48550/arxiv.2210.15131,Towards High-Quality Neural TTS for Low-Resource Languages by Learning Compact Speech Representations,"This paper aims to enhance low-resource TTS by reducing training data requirements using compact speech representations. A Multi-Stage Multi-Codebook (MSMC) VQ-GAN is trained to learn the representation, MSMCR, and decode it to waveforms. Subsequently, we train the multi-stage predictor to predict MSMCRs from the text for TTS synthesis. Moreover, we optimize the training strategy by leveraging more audio to learn MSMCRs better for low-resource languages. It selects audio from other languages using speaker similarity metric to augment the training set, and applies transfer learning to improve training quality. In MOS tests, the proposed system significantly outperforms FastSpeech and VITS in standard and low-resource scenarios, showing lower data requirements. The proposed training strategy effectively enhances MSMCRs on waveform reconstruction. It improves TTS performance further, which wins 77% votes in the preference test for the low-resource TTS with only 15 minutes of paired data.",1,,include (junior:5),https://arxiv.org/abs/2210.15131v1,https://arxiv.org/pdf/2210.15131v1,2022,discrete speech tokens,vq gan,"{""arxiv_id"": ""2210.15131"", ""title"": ""Towards High-Quality Neural TTS for Low-Resource Languages by Learning Compact Speech Representations"", ""summary"": ""This paper aims to enhance low-resource TTS by reducing training data requirements using compact speech representations. A Multi-Stage Multi-Codebook (MSMC) VQ-GAN is trained to learn the representation, MSMCR, and decode it to waveforms. Subsequently, we train the multi-stage predictor to predict MSMCRs from the text for TTS synthesis. Moreover, we optimize the training strategy by leveraging more audio to learn MSMCRs better for low-resource languages. It selects audio from other languages using speaker similarity metric to augment the training set, and applies transfer learning to improve training quality. In MOS tests, the proposed system significantly outperforms FastSpeech and VITS in standard and low-resource scenarios, showing lower data requirements. The proposed training strategy effectively enhances MSMCRs on waveform reconstruction. It improves TTS performance further, which wins 77% votes in the preference test for the low-resource TTS with only 15 minutes of paired data."", ""authors"": [""Haohan Guo"", ""Fenglong Xie"", ""Xixin Wu"", ""Hui Lu"", ""Helen Meng""], ""published"": ""2022-10-27T02:32:00Z"", ""updated"": ""2022-10-27T02:32:00Z"", ""categories"": [""cs.SD"", ""cs.CL"", ""eess.AS""], ""pdf_url"": ""https://arxiv.org/pdf/2210.15131v1"", ""landing_url"": ""https://arxiv.org/abs/2210.15131v1"", ""doi"": ""https://doi.org/10.48550/arXiv.2210.15131""}",2210.15131,https://openalex.org/W4307535422
